ID,Sent_1,Sent_2,Sent_3,Sent_4,Sent_5,Sent_6,Sent_7,Answer_1,Answer_2,Answer_3,Answer_4,Answer_5,Answer_6,Answer_value_1,Answer_value_2,Answer_value_3,Answer_value_4,Answer_value_5,Answer_value_6,Answer_label_1,Answer_label_2,Answer_label_3,Answer_label_4,Answer_label_5,Answer_label_6
571,Mes cousins observent que les copines du propriétaire des villas dormaient sur la plage .,Mes cousins observent que la copine du propriétaire des villas dormait sur la plage .,Mes cousins observent que les copines des propriétaires des villas dormaient sur la plage .,Mes cousins observent que la copine des propriétaires des villas dormait sur la plage .,Mes cousins observent que les copines du propriétaire de la villa dormaient sur la plage .,Mes cousins observent que la copine du propriétaire de la villa dormait sur la plage .,Mes cousins observent que les copines des propriétaires de la villa dormaient sur la plage .,Mes cousins observent que la copine des propriétaires de la villa de la villa dormait sur la plage .,Mes cousins observent que la copine des propriétaires de la villa dormaient sur la plage .,Mes cousins observent que la copine du propriétaire de la villa dormait sur la plage .,Mes cousins observent que les copines des propriétaires de la villa dormait sur la plage .,Mes cousins observent que la copine des propriétaires de la villa dormait sur la plage .,Mes cousins observent que la copine des propriétaires et la villa dormaient sur la plage .,False,False,False,False,True,False,mis_num,agreement_error,N2_alter,N1_alter,True,coordination
572,Les voisins trouvent que les accompagnatrices du musicien des rues jouaient merveilleusement .,Les voisins trouvent que l'accompagnatrice du musicien des rues jouait merveilleusement .,Les voisins trouvent que les accompagnatrices des musiciens des rues jouaient merveilleusement .,Les voisins trouvent que l'accompagnatrice des musiciens des rues jouait merveilleusement .,Les voisins trouvent que les accompagnatrices du musicien de la rue jouaient merveilleusement .,Les voisins trouvent que l'accompagnatrice du musicien de la rue jouait merveilleusement .,Les voisins trouvent que les accompagnatrices des musiciens de la rue jouaient merveilleusement .,Les voisins trouvent que l'accompagnatrice du musicien de la rue jouait merveilleusement .,Les voisins trouvent que l'accompagnatrice des musiciens de la rue jouait merveilleusement .,Les voisins trouvent que l'accompagnatrice des musiciens de la rue jouaient merveilleusement .,Les voisins trouvent que l'accompagnatrice des musiciens de la rue de la rue jouait merveilleusement .,Les voisins trouvent que les accompagnatrices des musiciens de la rue jouait merveilleusement .,Les voisins trouvent que l'accompagnatrice des musiciens et la rue jouaient merveilleusement .,False,True,False,False,False,False,N2_alter,True,agreement_error,mis_num,N1_alter,coordination
573,Mes amis disent que les professeurs de mon cousin sur les photos ressemblent à une star .,Mes amis disent que le professeur de mon cousin sur les photos ressemble à une star .,Mes amis disent que les professeurs de mes cousins sur les photos ressemblent à une star .,Mes amis disent que le professeur de mes cousins sur les photos ressemble à une star .,Mes amis disent que les professeurs de mon cousin sur la photo ressemblent à une star .,Mes amis disent que le professeur de mon cousin sur la photo ressemble à une star .,Mes amis disent que les professeurs de mes cousins sur la photo ressemblent à une star .,Mes amis disent que le professeur de mon cousin sur la photo ressemble à une star .,Mes amis disent que le professeur de mes cousins sur la photo ressemblent à une star .,Mes amis disent que le professeur de mes cousins sur la photo ressemble à une star .,Mes amis disent que le professeur de mes cousins sur la photo sur la photo ressemble à une star .,Mes amis disent que les professeurs de mes cousins sur la photo ressemble à une star .,Mes amis disent que le professeur de mes cousins et la photo ressemblent à une star .,False,False,True,False,False,False,N2_alter,agreement_error,True,mis_num,N1_alter,coordination
574,Les collègues savent que les entraîneurs du vainqueur des matchs vont recevoir une grosse récompense .,Les collègues savent que l'entraîneur du vainqueur des matchs va recevoir une grosse récompense .,Les collègues savent que les entraîneurs des vainqueurs des matchs vont recevoir une grosse récompense .,Les collègues savent que l'entraîneur des vainqueurs des matchs va recevoir une grosse récompense .,Les collègues savent que les entraîneurs du vainqueur du match vont recevoir une grosse récompense .,Les collègues savent que l'entraîneur du vainqueur du match va recevoir une grosse récompense .,Les collègues savent que les entraîneurs des vainqueurs du match vont recevoir une grosse récompense .,Les collègues savent que l'entraîneur des vainqueurs du match vont recevoir une grosse récompense .,Les collègues savent que l'entraîneur des vainqueurs du match du match va recevoir une grosse récompense .,Les collègues savent que l'entraîneur des vainqueurs et le match vont recevoir une grosse récompense .,Les collègues savent que les entraîneurs des vainqueurs du match va recevoir une grosse récompense .,Les collègues savent que l'entraîneur des vainqueurs du match va recevoir une grosse récompense .,Les collègues savent que l'entraîneur du vainqueur du match va recevoir une grosse récompense .,False,False,False,False,True,False,agreement_error,mis_num,coordination,N1_alter,True,N2_alter
575,Les voisins espèrent que les possesseurs du perroquet dans les arbres vont venir .,Les voisins espèrent que le possesseur du perroquet dans les arbres va venir .,Les voisins espèrent que les possesseurs des perroquets dans les arbres vont venir .,Les voisins espèrent que le possesseur des perroquets dans les arbres va venir .,Les voisins espèrent que les possesseurs du perroquet dans l'arbre vont venir .,Les voisins espèrent que le possesseur du perroquet dans l'arbre va venir .,Les voisins espèrent que les possesseurs des perroquets dans l'arbre vont venir .,Les voisins espèrent que le possesseur des perroquets dans l'arbre va venir .,Les voisins espèrent que le possesseur du perroquet dans l'arbre va venir .,Les voisins espèrent que le possesseur des perroquets et l'arbre vont venir .,Les voisins espèrent que le possesseur des perroquets dans l'arbre dans l'arbre va venir .,Les voisins espèrent que le possesseur des perroquets dans l'arbre vont venir .,Les voisins espèrent que les possesseurs des perroquets dans l'arbre va venir .,True,False,False,False,False,False,True,N2_alter,coordination,mis_num,agreement_error,N1_alter
576,Jean suppose que les ordinateurs avec les programmes sont en panne .,Jean suppose que l'ordinateur avec les programmes est en panne .,Jean suppose que les ordinateurs avec le programme sont en panne .,Jean suppose que l'ordinateur avec le programme est en panne .,Jean suppose que les ordinateurs avec les programmes de l'expérience sont en panne .,Jean suppose que l'ordinateur avec les programmes de l'expérience est en panne .,Jean suppose que les ordinateurs avec le programme de l'expérience sont en panne .,Jean suppose que l'ordinateur avec le programme de l'expérience de l'expérience est en panne .,Jean suppose que l'ordinateur avec le programme de l'expérience sont en panne .,Jean suppose que l'ordinateur avec les programmes de l'expérience est en panne .,Jean suppose que les ordinateurs avec le programme de l'expérience est en panne .,Jean suppose que l'ordinateur avec le programme de l'expérience est en panne .,Jean suppose que l'ordinateur avec le programme et l'expérience sont en panne .,False,False,False,False,True,False,mis_num,agreement_error,N2_alter,N1_alter,True,coordination
577,Le gouvernement a affirmé que les expositions avec les peintures ont rencontré un grand succès .,Le gouvernement a affirmé que l'exposition avec les peintures a rencontré un grand succès .,Le gouvernement a affirmé que les expositions avec la peinture ont rencontré un grand succès .,Le gouvernement a affirmé que l'exposition avec la peinture a rencontré un grand succès .,Le gouvernement a affirmé que les expositions avec les peintures de l'enfant ont rencontré un grand succès .,Le gouvernement a affirmé que l'exposition avec les peintures de l'enfant a rencontré un grand succès .,Le gouvernement a affirmé que les expositions avec la peinture de l'enfant ont rencontré un grand succès .,Le gouvernement a affirmé que l'exposition avec la peinture de l'enfant a rencontré un grand succès .,Le gouvernement a affirmé que l'exposition avec la peinture et l'enfant ont rencontré un grand succès .,Le gouvernement a affirmé que l'exposition avec la peinture de l'enfant ont rencontré un grand succès .,Le gouvernement a affirmé que les expositions avec la peinture de l'enfant a rencontré un grand succès .,Le gouvernement a affirmé que l'exposition avec la peinture de l'enfant de l'enfant a rencontré un grand succès .,Le gouvernement a affirmé que l'exposition avec les peintures de l'enfant a rencontré un grand succès .,True,False,False,False,False,False,True,coordination,agreement_error,N1_alter,mis_num,N2_alter
578,Marie dit que les trousseaux avec les clés reposent sur l’étagère .,Marie dit que le trousseau avec les clés repose sur l’étagère .,Marie dit que les trousseaux avec la clé reposent sur l’étagère .,Marie dit que le trousseau avec la clé repose sur l’étagère .,Marie dit que les trousseaux avec les clés de la cellule reposent sur l’étagère .,Marie dit que le trousseau avec les clés de la cellule repose sur l’étagère .,Marie dit que les trousseaux avec la clé de la cellule reposent sur l’étagère .,Marie dit que le trousseau avec la clé de la cellule de la cellule repose sur l’étagère .,Marie dit que le trousseau avec la clé et la cellule reposent sur l’étagère .,Marie dit que les trousseaux avec la clé de la cellule repose sur l’étagère .,Marie dit que le trousseau avec la clé de la cellule repose sur l’étagère .,Marie dit que le trousseau avec la clé de la cellule reposent sur l’étagère .,Marie dit que le trousseau avec les clés de la cellule repose sur l’étagère .,False,False,False,True,False,False,mis_num,coordination,N1_alter,True,agreement_error,N2_alter
579,L'éditeur a trouvé que les livres sur les privatisations ont enthousiasmé l’auditoire .,L'éditeur a trouvé que le livre sur les privatisations a enthousiasmé l’auditoire .,L'éditeur a trouvé que les livres sur la privatisation ont enthousiasmé l’auditoire .,L'éditeur a trouvé que le livre sur la privatisation a enthousiasmé l’auditoire .,L'éditeur a trouvé que les livres sur les privatisations de l'entreprise ont enthousiasmé l’auditoire .,L'éditeur a trouvé que le livre sur les privatisations de l'entreprise a enthousiasmé l’auditoire .,L'éditeur a trouvé que les livres sur la privatisation de l'entreprise ont enthousiasmé l’auditoire .,L'éditeur a trouvé que les livres sur la privatisation de l'entreprise a enthousiasmé l’auditoire .,L'éditeur a trouvé que le livre sur la privatisation de l'entreprise ont enthousiasmé l’auditoire .,L'éditeur a trouvé que le livre sur la privatisation de l'entreprise de l'entreprise a enthousiasmé l’auditoire .,L'éditeur a trouvé que le livre sur la privatisation et l'entreprise ont enthousiasmé l’auditoire .,L'éditeur a trouvé que le livre sur les privatisations de l'entreprise a enthousiasmé l’auditoire .,L'éditeur a trouvé que le livre sur la privatisation de l'entreprise a enthousiasmé l’auditoire .,False,False,False,False,False,True,N1_alter,agreement_error,mis_num,coordination,N2_alter,True
580,L'organizateur m'a informé que les conférences sur les histoires ont commencé plus tard que prévu .,L'organizateur m'a informé que la conférence sur les histoires a commencé plus tard que prévu .,L'organizateur m'a informé que les conférences sur l'histoire ont commencé plus tard que prévu .,L'organizateur m'a informé que la conférence sur l'histoire a commencé plus tard que prévu .,L'organizateur m'a informé que les conférences sur les histoires de la guerre ont commencé plus tard que prévu .,L'organizateur m'a informé que la conférence sur les histoires de la guerre a commencé plus tard que prévu .,L'organizateur m'a informé que les conférences sur l'histoire de la guerre ont commencé plus tard que prévu .,L'organizateur m'a informé que la conférence sur l'histoire de la guerre ont commencé plus tard que prévu .,L'organizateur m'a informé que la conférence sur l'histoire de la guerre a commencé plus tard que prévu .,L'organizateur m'a informé que la conférence sur les histoires de la guerre a commencé plus tard que prévu .,L'organizateur m'a informé que la conférence sur l'histoire et la guerre ont commencé plus tard que prévu .,L'organizateur m'a informé que la conférence sur l'histoire de la guerre de la guerre a commencé plus tard que prévu .,L'organizateur m'a informé que les conférences sur l'histoire de la guerre a commencé plus tard que prévu .,False,True,False,False,False,False,agreement_error,True,N2_alter,coordination,mis_num,N1_alter
581,L'auteur croit que les études sur les effet apparaîtront bientôt .,L'auteur croit que l'étude sur les effet apparaîtra bientôt .,L'auteur croit que les études sur l'effet apparaîtront bientôt .,L'auteur croit que l'étude sur l'effet apparaîtra bientôt .,L'auteur croit que les études sur les effet de la drogue apparaîtront bientôt .,L'auteur croit que l'étude sur les effet de la drogue apparaîtra bientôt .,L'auteur croit que les études sur l'effet de la drogue apparaîtront bientôt .,L'auteur croit que l'étude sur l'effet de la drogue apparaîtront bientôt .,L'auteur croit que l'étude sur l'effet et la drogue apparaîtront bientôt .,L'auteur croit que les études sur l'effet de la drogue apparaîtra bientôt .,L'auteur croit que l'étude sur l'effet de la drogue apparaîtra bientôt .,L'auteur croit que l'étude sur l'effet de la drogue de la drogue apparaîtra bientôt .,L'auteur croit que l'étude sur les effet de la drogue apparaîtra bientôt .,False,False,False,True,False,False,agreement_error,coordination,N1_alter,True,mis_num,N2_alter
582,L'article a rapporté que les théories sur les chants divisent les chercheurs .,L'article a rapporté que la théorie sur les chants divise les chercheurs .,L'article a rapporté que les théories sur le chant divisent les chercheurs .,L'article a rapporté que la théorie sur le chant divise les chercheurs .,L'article a rapporté que les théories sur les chants du canari divisent les chercheurs .,L'article a rapporté que la théorie sur les chants du canari divise les chercheurs .,L'article a rapporté que les théories sur le chant du canari divisent les chercheurs .,L'article a rapporté que la théorie sur le chant du canari du canari divise les chercheurs .,L'article a rapporté que la théorie sur le chant du canari divisent les chercheurs .,L'article a rapporté que la théorie sur le chant du canari divise les chercheurs .,L'article a rapporté que les théories sur le chant du canari divise les chercheurs .,L'article a rapporté que la théorie sur les chants du canari divise les chercheurs .,L'article a rapporté que la théorie sur le chant et le canari divisent les chercheurs .,False,False,True,False,False,False,mis_num,agreement_error,True,N1_alter,N2_alter,coordination
583,Ma voisine a raconté que les inscriptions sur les portes ont énervé sa mère .,Ma voisine a raconté que l'inscription sur les portes a énervé sa mère .,Ma voisine a raconté que les inscriptions sur la porte ont énervé sa mère .,Ma voisine a raconté que l'inscription sur la porte a énervé sa mère .,Ma voisine a raconté que les inscriptions sur les portes de la chambre ont énervé sa mère .,Ma voisine a raconté que l'inscription sur les portes de la chambre a énervé sa mère .,Ma voisine a raconté que les inscriptions sur la porte de la chambre ont énervé sa mère .,Ma voisine a raconté que l'inscription sur la porte de la chambre a énervé sa mère .,Ma voisine a raconté que les inscriptions sur la porte de la chambre a énervé sa mère .,Ma voisine a raconté que l'inscription sur les portes de la chambre a énervé sa mère .,Ma voisine a raconté que l'inscription sur la porte de la chambre ont énervé sa mère .,Ma voisine a raconté que l'inscription sur la porte et la chambre ont énervé sa mère .,Ma voisine a raconté que l'inscription sur la porte de la chambre de la chambre a énervé sa mère .,True,False,False,False,False,False,True,N1_alter,N2_alter,agreement_error,coordination,mis_num
584,Le journal a mentionné que les dépliants sur les enjeux ont beaucoup intéressé .,Le journal a mentionné que le dépliant sur les enjeux a beaucoup intéressé .,Le journal a mentionné que les dépliants sur l'enjeu ont beaucoup intéressé .,Le journal a mentionné que le dépliant sur l'enjeu a beaucoup intéressé .,Le journal a mentionné que les dépliants sur les enjeux de la communauté ont beaucoup intéressé .,Le journal a mentionné que le dépliant sur les enjeux de la communauté a beaucoup intéressé .,Le journal a mentionné que les dépliants sur l'enjeu de la communauté ont beaucoup intéressé .,Le journal a mentionné que le dépliant sur l'enjeu et la communauté ont beaucoup intéressé .,Le journal a mentionné que le dépliant sur l'enjeu de la communauté de la communauté a beaucoup intéressé .,Le journal a mentionné que le dépliant sur les enjeux de la communauté a beaucoup intéressé .,Le journal a mentionné que le dépliant sur l'enjeu de la communauté a beaucoup intéressé .,Le journal a mentionné que le dépliant sur l'enjeu de la communauté ont beaucoup intéressé .,Le journal a mentionné que les dépliants sur l'enjeu de la communauté a beaucoup intéressé .,False,False,False,True,False,False,coordination,mis_num,N2_alter,True,agreement_error,N1_alter
585,Ma cousine m'a dit que les lignes sur les bords ont disparu .,Ma cousine m'a dit que la ligne sur les bords a disparu .,Ma cousine m'a dit que les lignes sur le bord ont disparu .,Ma cousine m'a dit que la ligne sur le bord a disparu .,Ma cousine m'a dit que les lignes sur les bords de la route ont disparu .,Ma cousine m'a dit que la ligne sur les bords de la route a disparu .,Ma cousine m'a dit que les lignes sur le bord de la route ont disparu .,Ma cousine m'a dit que la ligne sur le bord de la route ont disparu .,Ma cousine m'a dit que la ligne sur le bord de la route de la route a disparu .,Ma cousine m'a dit que les lignes sur le bord de la route a disparu .,Ma cousine m'a dit que la ligne sur le bord et la route ont disparu .,Ma cousine m'a dit que la ligne sur les bords de la route a disparu .,Ma cousine m'a dit que la ligne sur le bord de la route a disparu .,False,False,False,False,False,True,agreement_error,mis_num,N1_alter,coordination,N2_alter,True
586,Julie a réalisé que les nappes sur les tables brillent au soleil .,Julie a réalisé que la nappe sur les tables brille au soleil .,Julie a réalisé que les nappes sur la table brillent au soleil .,Julie a réalisé que la nappe sur la table brille au soleil .,Julie a réalisé que les nappes sur les tables du banquet brillent au soleil .,Julie a réalisé que la nappe sur les tables du banquet brille au soleil .,Julie a réalisé que les nappes sur la table du banquet brillent au soleil .,Julie a réalisé que la nappe sur les tables du banquet brille au soleil .,Julie a réalisé que les nappes sur la table du banquet brille au soleil .,Julie a réalisé que la nappe sur la table du banquet du banquet brille au soleil .,Julie a réalisé que la nappe sur la table et le banquet brillent au soleil .,Julie a réalisé que la nappe sur la table du banquet brille au soleil .,Julie a réalisé que la nappe sur la table du banquet brillent au soleil .,False,False,False,False,True,False,N2_alter,N1_alter,mis_num,coordination,True,agreement_error
587,Le médecin constate que les récits de les souffrances touchent les participants .,Le médecin constate que le récit de les souffrances touche les participants .,Le médecin constate que les récits de la souffrance touchent les participants .,Le médecin constate que le récit de la souffrance touche les participants .,Le médecin constate que les récits de les souffrances dans l'hôpital touchent les participants .,Le médecin constate que le récit de les souffrances dans l'hôpital touche les participants .,Le médecin constate que les récits de la souffrance dans l'hôpital touchent les participants .,Le médecin constate que le récit de la souffrance dans l'hôpital dans l'hôpital touche les participants .,Le médecin constate que le récit de les souffrances dans l'hôpital touche les participants .,Le médecin constate que le récit de la souffrance dans l'hôpital touchent les participants .,Le médecin constate que le récit de la souffrance dans l'hôpital touche les participants .,Le médecin constate que les récits de la souffrance dans l'hôpital touche les participants .,Le médecin constate que le récit de la souffrance et l'hôpital touchent les participants .,False,False,False,True,False,False,mis_num,N2_alter,agreement_error,True,N1_alter,coordination
588,Ma nièce réalise que les visites aux palais approchent .,Ma nièce réalise que la visite aux palais approche .,Ma nièce réalise que les visites au palais approchent .,Ma nièce réalise que la visite au palais approche .,Ma nièce réalise que les visites aux palais de l'artisanat approchent .,Ma nièce réalise que la visite aux palais de l'artisanat approche .,Ma nièce réalise que les visites au palais de l'artisanat approchent .,Ma nièce réalise que la visite aux palais de l'artisanat approche .,Ma nièce réalise que les visites au palais de l'artisanat approche .,Ma nièce réalise que la visite au palais et l'artisanat approchent .,Ma nièce réalise que la visite au palais de l'artisanat de l'artisanat approche .,Ma nièce réalise que la visite au palais de l'artisanat approchent .,Ma nièce réalise que la visite au palais de l'artisanat approche .,False,False,False,False,False,True,N2_alter,N1_alter,coordination,mis_num,agreement_error,True
589,Le président trouve que les menaces de les réformes inquiètent les médecins .,Le président trouve que la menace de les réformes inquiète les médecins .,Le président trouve que les menaces de la réforme inquiètent les médecins .,Le président trouve que la menace de la réforme inquiète les médecins .,Le président trouve que les menaces de les réformes dans l'école inquiètent les médecins .,Le président trouve que la menace de les réformes dans l'école inquiète les médecins .,Le président trouve que les menaces de la réforme dans l'école inquiètent les médecins .,Le président trouve que les menaces de la réforme dans l'école inquiète les médecins .,Le président trouve que la menace de la réforme et l'école inquiètent les médecins .,Le président trouve que la menace de la réforme dans l'école inquiètent les médecins .,Le président trouve que la menace de les réformes dans l'école inquiète les médecins .,Le président trouve que la menace de la réforme dans l'école dans l'école inquiète les médecins .,Le président trouve que la menace de la réforme dans l'école inquiète les médecins .,False,False,False,False,False,True,N1_alter,coordination,agreement_error,N2_alter,mis_num,True
590,La police a dit que les hélicopteres pour les vols s’écrasent .,La police a dit que l'hélicoptere pour les vols s'écrase .,La police a dit que les hélicopteres pour le vol s’écrasent .,La police a dit que l'hélicoptere pour le vol s'écrase .,La police a dit que les hélicopteres pour les vols au-dessus du canyon s’écrasent .,La police a dit que l'hélicoptere pour les vols au-dessus du canyon s'écrase .,La police a dit que les hélicopteres pour le vol au-dessus du canyon s’écrasent .,La police a dit que l'hélicoptere pour le vol au-dessus du canyon s’écrasent .,La police a dit que l'hélicoptere pour les vols au-dessus du canyon s'écrase .,La police a dit que l'hélicoptere pour le vol et le canyon s’écrasent .,La police a dit que l'hélicoptere pour le vol au-dessus du canyon au-dessus du canyon s'écrase .,La police a dit que l'hélicoptere pour le vol au-dessus du canyon s'écrase .,La police a dit que les hélicopteres pour le vol au-dessus du canyon s'écrase .,False,False,False,False,True,False,agreement_error,N2_alter,coordination,mis_num,True,N1_alter
