ID,Sent_1,Sent_2,Sent_3,Sent_4,Sent_5,Sent_6,Sent_7,Answer_1,Answer_2,Answer_3,Answer_4,Answer_5,Answer_6,Answer_value_1,Answer_value_2,Answer_value_3,Answer_value_4,Answer_value_5,Answer_value_6,Answer_label_1,Answer_label_2,Answer_label_3,Answer_label_4,Answer_label_5,Answer_label_6
367,Mon ami a remarqué que la soirée dans les appartements des sous-sols a gêné les voisins .,Mon ami a remarqué que les soirées dans les appartements des sous-sols ont gêné les voisins .,Mon ami a remarqué que la soirée dans l'appartement des sous-sols a gêné les voisins .,Mon ami a remarqué que les soirées dans l'appartement des sous-sols ont gêné les voisins .,Mon ami a remarqué que la soirée dans les appartements du sous-sol a gêné les voisins .,Mon ami a remarqué que les soirées dans les appartements du sous-sol ont gêné les voisins .,Mon ami a remarqué que la soirée dans l'appartement du sous-sol a gêné les voisins .,Mon ami a remarqué que les soirées dans l'appartement du sous-sol du sous-sol ont gêné les voisins .,Mon ami a remarqué que les soirées dans l'appartement du sous-sol ont gêné les voisins .,Mon ami a remarqué que les soirées dans l'appartement du sous-sol a gêné les voisins .,Mon ami a remarqué que la soirée dans l'appartement du sous-sol ont gêné les voisins .,Mon ami a remarqué que les soirées dans les appartements du sous-sol ont gêné les voisins .,Mon ami a remarqué que les soirées dans l'appartement et le sous-sol ont gêné les voisins .,False,True,False,False,False,False,mis_num,True,agreement_error,N1_alter,N2_alter,coordination
368,Les spectateurs ont appris que le producteur des films sur les artistes a gagné la palme d’or .,Les spectateurs ont appris que les producteurs des films sur les artistes ont gagné la palme d’or .,Les spectateurs ont appris que le producteur du film sur les artistes a gagné la palme d’or .,Les spectateurs ont appris que les producteurs du film sur les artistes ont gagné la palme d’or .,Les spectateurs ont appris que le producteur des films sur l'artiste a gagné la palme d’or .,Les spectateurs ont appris que les producteurs des films sur l'artiste ont gagné la palme d’or .,Les spectateurs ont appris que le producteur du film sur l'artiste a gagné la palme d’or .,Les spectateurs ont appris que les producteurs des films sur l'artiste ont gagné la palme d’or .,Les spectateurs ont appris que le producteur du film sur l'artiste ont gagné la palme d’or .,Les spectateurs ont appris que les producteurs du film sur l'artiste a gagné la palme d’or .,Les spectateurs ont appris que les producteurs du film sur l'artiste ont gagné la palme d’or .,Les spectateurs ont appris que les producteurs du film sur l'artiste sur l'artiste ont gagné la palme d’or .,Les spectateurs ont appris que les producteurs du film et l'artiste ont gagné la palme d’or .,False,False,False,True,False,False,N2_alter,N1_alter,agreement_error,True,mis_num,coordination
369,Mes enfants m'ont dit que le chat sur les toits des voisins miaule depuis hier soir .,Mes enfants m'ont dit que les chats sur les toits des voisins miaulent depuis hier soir .,Mes enfants m'ont dit que le chat sur le toit des voisins miaule depuis hier soir .,Mes enfants m'ont dit que les chats sur le toit des voisins miaulent depuis hier soir .,Mes enfants m'ont dit que le chat sur les toits du voisin miaule depuis hier soir .,Mes enfants m'ont dit que les chats sur les toits du voisin miaulent depuis hier soir .,Mes enfants m'ont dit que le chat sur le toit du voisin miaule depuis hier soir .,Mes enfants m'ont dit que les chats sur le toit du voisin miaule depuis hier soir .,Mes enfants m'ont dit que les chats sur le toit du voisin miaulent depuis hier soir .,Mes enfants m'ont dit que les chats sur les toits du voisin miaulent depuis hier soir .,Mes enfants m'ont dit que le chat sur le toit du voisin miaulent depuis hier soir .,Mes enfants m'ont dit que les chats sur le toit et le voisin miaulent depuis hier soir .,Mes enfants m'ont dit que les chats sur le toit du voisin du voisin miaulent depuis hier soir .,False,True,False,False,False,False,agreement_error,True,N2_alter,N1_alter,coordination,mis_num
370,Mes parents remarquent que le chien sur les coussins des bébés s'endormait .,Mes parents remarquent que les chiens sur les coussins des bébés s’endormaient .,Mes parents remarquent que le chien sur le coussin des bébés s'endormait .,Mes parents remarquent que les chiens sur le coussin des bébés s’endormaient .,Mes parents remarquent que le chien sur les coussins du bébé s'endormait .,Mes parents remarquent que les chiens sur les coussins du bébé s’endormaient .,Mes parents remarquent que le chien sur le coussin du bébé s'endormait .,Mes parents remarquent que les chiens sur le coussin du bébé s’endormaient .,Mes parents remarquent que les chiens sur le coussin du bébé du bébé s’endormaient .,Mes parents remarquent que les chiens sur les coussins du bébé s’endormaient .,Mes parents remarquent que les chiens sur le coussin et le bébé s’endormaient .,Mes parents remarquent que les chiens sur le coussin du bébé s'endormait .,Mes parents remarquent que le chien sur le coussin du bébé s’endormaient .,True,False,False,False,False,False,True,mis_num,N2_alter,coordination,agreement_error,N1_alter
371,Les collègues ont vu que le gréviste sur les escaliers des patrons bloquait la porte .,Les collègues ont vu que les grévistes sur les escaliers des patrons bloquaient la porte .,Les collègues ont vu que le gréviste sur l'escalier des patrons bloquait la porte .,Les collègues ont vu que les grévistes sur l'escalier des patrons bloquaient la porte .,Les collègues ont vu que le gréviste sur les escaliers du patron bloquait la porte .,Les collègues ont vu que les grévistes sur les escaliers du patron bloquaient la porte .,Les collègues ont vu que le gréviste sur l'escalier du patron bloquait la porte .,Les collègues ont vu que les grévistes sur l'escalier du patron bloquaient la porte .,Les collègues ont vu que les grévistes sur l'escalier du patron bloquait la porte .,Les collègues ont vu que les grévistes sur l'escalier du patron du patron bloquaient la porte .,Les collègues ont vu que les grévistes sur l'escalier et le patron bloquaient la porte .,Les collègues ont vu que le gréviste sur l'escalier du patron bloquaient la porte .,Les collègues ont vu que les grévistes sur les escaliers du patron bloquaient la porte .,True,False,False,False,False,False,True,agreement_error,mis_num,coordination,N1_alter,N2_alter
372,Les administrateurs ont constaté que l'architecte des châteaux des millionnaires a perdu les plans .,Les administrateurs ont constaté que les architectes des châteaux des millionnaires ont perdu les plans .,Les administrateurs ont constaté que l'architecte du château des millionnaires a perdu les plans .,Les administrateurs ont constaté que les architectes du château des millionnaires ont perdu les plans .,Les administrateurs ont constaté que l'architecte des châteaux du millionnaire a perdu les plans .,Les administrateurs ont constaté que les architectes des châteaux du millionnaire ont perdu les plans .,Les administrateurs ont constaté que l'architecte du château du millionnaire a perdu les plans .,Les administrateurs ont constaté que les architectes du château du millionnaire du millionnaire ont perdu les plans .,Les administrateurs ont constaté que les architectes des châteaux du millionnaire ont perdu les plans .,Les administrateurs ont constaté que les architectes du château du millionnaire a perdu les plans .,Les administrateurs ont constaté que les architectes du château et le millionnaire ont perdu les plans .,Les administrateurs ont constaté que l'architecte du château du millionnaire ont perdu les plans .,Les administrateurs ont constaté que les architectes du château du millionnaire ont perdu les plans .,False,False,False,False,False,True,mis_num,N2_alter,agreement_error,coordination,N1_alter,True
373,Les journalistes ont rapporté que la victime des mensonges des policiers a porté plainte .,Les journalistes ont rapporté que les victimes des mensonges des policiers ont porté plainte .,Les journalistes ont rapporté que la victime du mensonge des policiers a porté plainte .,Les journalistes ont rapporté que les victimes du mensonge des policiers ont porté plainte .,Les journalistes ont rapporté que la victime des mensonges du policier a porté plainte .,Les journalistes ont rapporté que les victimes des mensonges du policier ont porté plainte .,Les journalistes ont rapporté que la victime du mensonge du policier a porté plainte .,Les journalistes ont rapporté que les victimes du mensonge du policier a porté plainte .,Les journalistes ont rapporté que la victime du mensonge du policier ont porté plainte .,Les journalistes ont rapporté que les victimes du mensonge du policier du policier ont porté plainte .,Les journalistes ont rapporté que les victimes du mensonge du policier ont porté plainte .,Les journalistes ont rapporté que les victimes des mensonges du policier ont porté plainte .,Les journalistes ont rapporté que les victimes du mensonge et le policier ont porté plainte .,False,False,False,True,False,False,agreement_error,N1_alter,mis_num,True,N2_alter,coordination
374,Les villageois ont trouvé que le voleur des voitures des garagistes a fait une embardée .,Les villageois ont trouvé que les voleurs des voitures des garagistes ont fait une embardée .,Les villageois ont trouvé que le voleur de la voiture des garagistes a fait une embardée .,Les villageois ont trouvé que les voleurs de la voiture des garagistes ont fait une embardée .,Les villageois ont trouvé que le voleur des voitures du garagiste a fait une embardée .,Les villageois ont trouvé que les voleurs des voitures du garagiste ont fait une embardée .,Les villageois ont trouvé que le voleur de la voiture du garagiste a fait une embardée .,Les villageois ont trouvé que les voleurs de la voiture du garagiste a fait une embardée .,Les villageois ont trouvé que le voleur de la voiture du garagiste ont fait une embardée .,Les villageois ont trouvé que les voleurs de la voiture du garagiste du garagiste ont fait une embardée .,Les villageois ont trouvé que les voleurs de la voiture du garagiste ont fait une embardée .,Les villageois ont trouvé que les voleurs de la voiture et le garagiste ont fait une embardée .,Les villageois ont trouvé que les voleurs des voitures du garagiste ont fait une embardée .,False,False,False,True,False,False,agreement_error,N1_alter,mis_num,True,coordination,N2_alter
375,Les étudiants apprennent que le responsable des droits des immigrés va démissionner .,Les étudiants apprennent que les responsables des droits des immigrés vont démissionner .,Les étudiants apprennent que le responsable du droit des immigrés va démissionner .,Les étudiants apprennent que les responsables du droit des immigrés vont démissionner .,Les étudiants apprennent que le responsable des droits de l'immigré va démissionner .,Les étudiants apprennent que les responsables des droits de l'immigré vont démissionner .,Les étudiants apprennent que le responsable du droit de l'immigré va démissionner .,Les étudiants apprennent que les responsables du droit de l'immigré de l'immigré vont démissionner .,Les étudiants apprennent que les responsables du droit de l'immigré va démissionner .,Les étudiants apprennent que les responsables du droit de l'immigré vont démissionner .,Les étudiants apprennent que les responsables des droits de l'immigré vont démissionner .,Les étudiants apprennent que les responsables du droit et l'immigré vont démissionner .,Les étudiants apprennent que le responsable du droit de l'immigré vont démissionner .,False,False,True,False,False,False,mis_num,agreement_error,True,N2_alter,coordination,N1_alter
376,Les enfants disent que le gamin des clochards près des poubelles pleure .,Les enfants disent que les gamins des clochards près des poubelles pleurent .,Les enfants disent que le gamin du clochard près des poubelles pleure .,Les enfants disent que les gamins du clochard près des poubelles pleurent .,Les enfants disent que le gamin des clochards près de la poubelle pleure .,Les enfants disent que les gamins des clochards près de la poubelle pleurent .,Les enfants disent que le gamin du clochard près de la poubelle pleure .,Les enfants disent que les gamins du clochard près de la poubelle près de la poubelle pleurent .,Les enfants disent que les gamins du clochard près de la poubelle pleurent .,Les enfants disent que le gamin du clochard près de la poubelle pleurent .,Les enfants disent que les gamins des clochards près de la poubelle pleurent .,Les enfants disent que les gamins du clochard et de la poubelle pleurent .,Les enfants disent que les gamins du clochard près de la poubelle pleure .,False,True,False,False,False,False,mis_num,True,N1_alter,N2_alter,coordination,agreement_error
377,Les procureurs pensent que l'avocat des assassins des villages va revenir .,Les procureurs pensent que les avocats des assassins des villages vont revenir .,Les procureurs pensent que l'avocat de l'assassin des villages va revenir .,Les procureurs pensent que les avocats de l'assassin des villages vont revenir .,Les procureurs pensent que l'avocat des assassins du village va revenir .,Les procureurs pensent que les avocats des assassins du village vont revenir .,Les procureurs pensent que l'avocat de l'assassin du village va revenir .,Les procureurs pensent que l'avocat de l'assassin du village vont revenir .,Les procureurs pensent que les avocats de l'assassin du village du village vont revenir .,Les procureurs pensent que les avocats de l'assassin du village va revenir .,Les procureurs pensent que les avocats de l'assassin du village vont revenir .,Les procureurs pensent que les avocats des assassins du village vont revenir .,Les procureurs pensent que les avocats de l'assassin et le village vont revenir .,False,False,False,True,False,False,N1_alter,mis_num,agreement_error,True,N2_alter,coordination
378,Les éleveurs ont dit que le cochon des laboureurs des champs se vautrait dans la mare .,Les éleveurs ont dit que les cochons des laboureurs des champs se vautraient dans la mare .,Les éleveurs ont dit que le cochon du laboureur des champs se vautrait dans la mare .,Les éleveurs ont dit que les cochons du laboureur des champs se vautraient dans la mare .,Les éleveurs ont dit que le cochon des laboureurs du champs se vautrait dans la mare .,Les éleveurs ont dit que les cochons des laboureurs du champs se vautraient dans la mare .,Les éleveurs ont dit que le cochon du laboureur du champs se vautrait dans la mare .,Les éleveurs ont dit que les cochons du laboureur du champs du champs se vautraient dans la mare .,Les éleveurs ont dit que les cochons du laboureur et le champs se vautraient dans la mare .,Les éleveurs ont dit que le cochon du laboureur du champs se vautraient dans la mare .,Les éleveurs ont dit que les cochons du laboureur du champs se vautraient dans la mare .,Les éleveurs ont dit que les cochons du laboureur du champs se vautrait dans la mare .,Les éleveurs ont dit que les cochons des laboureurs du champs se vautraient dans la mare .,False,False,False,True,False,False,mis_num,coordination,N1_alter,True,agreement_error,N2_alter
379,Mes cousins observent que la copine des propriétaires des villas dormait sur la plage .,Mes cousins observent que les copines des propriétaires des villas dormaient sur la plage .,Mes cousins observent que la copine du propriétaire des villas dormait sur la plage .,Mes cousins observent que les copines du propriétaire des villas dormaient sur la plage .,Mes cousins observent que la copine des propriétaires de la villa dormait sur la plage .,Mes cousins observent que les copines des propriétaires de la villa dormaient sur la plage .,Mes cousins observent que la copine du propriétaire de la villa dormait sur la plage .,Mes cousins observent que les copines des propriétaires de la villa dormaient sur la plage .,Mes cousins observent que les copines du propriétaire de la villa de la villa dormaient sur la plage .,Mes cousins observent que les copines du propriétaire de la villa dormait sur la plage .,Mes cousins observent que les copines du propriétaire de la villa dormaient sur la plage .,Mes cousins observent que la copine du propriétaire de la villa dormaient sur la plage .,Mes cousins observent que les copines du propriétaire et la villa dormaient sur la plage .,False,False,False,True,False,False,N2_alter,mis_num,agreement_error,True,N1_alter,coordination
380,Les voisins trouvent que l'accompagnatrice des musiciens des rues jouait merveilleusement .,Les voisins trouvent que les accompagnatrices des musiciens des rues jouaient merveilleusement .,Les voisins trouvent que l'accompagnatrice du musicien des rues jouait merveilleusement .,Les voisins trouvent que les accompagnatrices du musicien des rues jouaient merveilleusement .,Les voisins trouvent que l'accompagnatrice des musiciens de la rue jouait merveilleusement .,Les voisins trouvent que les accompagnatrices des musiciens de la rue jouaient merveilleusement .,Les voisins trouvent que l'accompagnatrice du musicien de la rue jouait merveilleusement .,Les voisins trouvent que les accompagnatrices du musicien de la rue de la rue jouaient merveilleusement .,Les voisins trouvent que les accompagnatrices du musicien et la rue jouaient merveilleusement .,Les voisins trouvent que les accompagnatrices des musiciens de la rue jouaient merveilleusement .,Les voisins trouvent que l'accompagnatrice du musicien de la rue jouaient merveilleusement .,Les voisins trouvent que les accompagnatrices du musicien de la rue jouait merveilleusement .,Les voisins trouvent que les accompagnatrices du musicien de la rue jouaient merveilleusement .,False,False,False,False,False,True,mis_num,coordination,N2_alter,N1_alter,agreement_error,True
381,Mes amis disent que le professeur de mes cousins sur les photos ressemble à une star .,Mes amis disent que les professeurs de mes cousins sur les photos ressemblent à une star .,Mes amis disent que le professeur de mon cousin sur les photos ressemble à une star .,Mes amis disent que les professeurs de mon cousin sur les photos ressemblent à une star .,Mes amis disent que le professeur de mes cousins sur la photo ressemble à une star .,Mes amis disent que les professeurs de mes cousins sur la photo ressemblent à une star .,Mes amis disent que le professeur de mon cousin sur la photo ressemble à une star .,Mes amis disent que les professeurs de mon cousin sur la photo sur la photo ressemblent à une star .,Mes amis disent que les professeurs de mon cousin sur la photo ressemblent à une star .,Mes amis disent que le professeur de mon cousin sur la photo ressemblent à une star .,Mes amis disent que les professeurs de mes cousins sur la photo ressemblent à une star .,Mes amis disent que les professeurs de mon cousin sur la photo ressemble à une star .,Mes amis disent que les professeurs de mon cousin et la photo ressemblent à une star .,False,True,False,False,False,False,mis_num,True,N1_alter,N2_alter,agreement_error,coordination
382,Les collègues savent que l'entraîneur des vainqueurs des matchs va recevoir une grosse récompense .,Les collègues savent que les entraîneurs des vainqueurs des matchs vont recevoir une grosse récompense .,Les collègues savent que l'entraîneur du vainqueur des matchs va recevoir une grosse récompense .,Les collègues savent que les entraîneurs du vainqueur des matchs vont recevoir une grosse récompense .,Les collègues savent que l'entraîneur des vainqueurs du match va recevoir une grosse récompense .,Les collègues savent que les entraîneurs des vainqueurs du match vont recevoir une grosse récompense .,Les collègues savent que l'entraîneur du vainqueur du match va recevoir une grosse récompense .,Les collègues savent que les entraîneurs du vainqueur du match vont recevoir une grosse récompense .,Les collègues savent que les entraîneurs du vainqueur du match va recevoir une grosse récompense .,Les collègues savent que les entraîneurs des vainqueurs du match vont recevoir une grosse récompense .,Les collègues savent que les entraîneurs du vainqueur et le match vont recevoir une grosse récompense .,Les collègues savent que les entraîneurs du vainqueur du match du match vont recevoir une grosse récompense .,Les collègues savent que l'entraîneur du vainqueur du match vont recevoir une grosse récompense .,True,False,False,False,False,False,True,agreement_error,N2_alter,coordination,mis_num,N1_alter
383,Les voisins espèrent que le possesseur des perroquets dans les arbres va venir .,Les voisins espèrent que les possesseurs des perroquets dans les arbres vont venir .,Les voisins espèrent que le possesseur du perroquet dans les arbres va venir .,Les voisins espèrent que les possesseurs du perroquet dans les arbres vont venir .,Les voisins espèrent que le possesseur des perroquets dans l'arbre va venir .,Les voisins espèrent que les possesseurs des perroquets dans l'arbre vont venir .,Les voisins espèrent que le possesseur du perroquet dans l'arbre va venir .,Les voisins espèrent que les possesseurs du perroquet et l'arbre vont venir .,Les voisins espèrent que les possesseurs du perroquet dans l'arbre dans l'arbre vont venir .,Les voisins espèrent que les possesseurs du perroquet dans l'arbre va venir .,Les voisins espèrent que le possesseur du perroquet dans l'arbre vont venir .,Les voisins espèrent que les possesseurs des perroquets dans l'arbre vont venir .,Les voisins espèrent que les possesseurs du perroquet dans l'arbre vont venir .,False,False,False,False,False,True,coordination,mis_num,agreement_error,N1_alter,N2_alter,True
384,Jean suppose que les ordinateurs avec le programme sont en panne .,Jean suppose que l'ordinateur avec le programme est en panne .,Jean suppose que les ordinateurs avec les programmes sont en panne .,Jean suppose que l'ordinateur avec les programmes est en panne .,Jean suppose que les ordinateurs avec le programme de l'expérience sont en panne .,Jean suppose que l'ordinateur avec le programme de l'expérience est en panne .,Jean suppose que les ordinateurs avec les programmes de l'expérience sont en panne .,Jean suppose que l'ordinateur avec les programmes de l'expérience est en panne .,Jean suppose que les ordinateurs avec les programmes de l'expérience est en panne .,Jean suppose que l'ordinateur avec les programmes de l'expérience de l'expérience est en panne .,Jean suppose que l'ordinateur avec les programmes de l'expérience sont en panne .,Jean suppose que l'ordinateur avec les programmes et l'expérience sont en panne .,Jean suppose que l'ordinateur avec le programme de l'expérience est en panne .,True,False,False,False,False,False,True,N1_alter,mis_num,agreement_error,coordination,N2_alter
385,Le gouvernement a affirmé que les expositions avec la peinture ont rencontré un grand succès .,Le gouvernement a affirmé que l'exposition avec la peinture a rencontré un grand succès .,Le gouvernement a affirmé que les expositions avec les peintures ont rencontré un grand succès .,Le gouvernement a affirmé que l'exposition avec les peintures a rencontré un grand succès .,Le gouvernement a affirmé que les expositions avec la peinture de l'enfant ont rencontré un grand succès .,Le gouvernement a affirmé que l'exposition avec la peinture de l'enfant a rencontré un grand succès .,Le gouvernement a affirmé que les expositions avec les peintures de l'enfant ont rencontré un grand succès .,Le gouvernement a affirmé que les expositions avec les peintures de l'enfant a rencontré un grand succès .,Le gouvernement a affirmé que l'exposition avec les peintures de l'enfant de l'enfant a rencontré un grand succès .,Le gouvernement a affirmé que l'exposition avec la peinture de l'enfant a rencontré un grand succès .,Le gouvernement a affirmé que l'exposition avec les peintures et l'enfant ont rencontré un grand succès .,Le gouvernement a affirmé que l'exposition avec les peintures de l'enfant ont rencontré un grand succès .,Le gouvernement a affirmé que l'exposition avec les peintures de l'enfant a rencontré un grand succès .,False,False,False,False,False,True,N1_alter,mis_num,N2_alter,coordination,agreement_error,True
386,Marie dit que les trousseaux avec la clé reposent sur l’étagère .,Marie dit que le trousseau avec la clé repose sur l’étagère .,Marie dit que les trousseaux avec les clés reposent sur l’étagère .,Marie dit que le trousseau avec les clés repose sur l’étagère .,Marie dit que les trousseaux avec la clé de la cellule reposent sur l’étagère .,Marie dit que le trousseau avec la clé de la cellule repose sur l’étagère .,Marie dit que les trousseaux avec les clés de la cellule reposent sur l’étagère .,Marie dit que le trousseau avec les clés de la cellule repose sur l’étagère .,Marie dit que le trousseau avec les clés de la cellule reposent sur l’étagère .,Marie dit que le trousseau avec les clés et la cellule reposent sur l’étagère .,Marie dit que les trousseaux avec les clés de la cellule repose sur l’étagère .,Marie dit que le trousseau avec les clés de la cellule de la cellule repose sur l’étagère .,Marie dit que le trousseau avec la clé de la cellule repose sur l’étagère .,True,False,False,False,False,False,True,agreement_error,coordination,N1_alter,mis_num,N2_alter
