ID,Sent_1,Sent_2,Sent_3,Sent_4,Sent_5,Sent_6,Sent_7,Answer_1,Answer_2,Answer_3,Answer_4,Answer_5,Answer_6,Answer_value_1,Answer_value_2,Answer_value_3,Answer_value_4,Answer_value_5,Answer_value_6,Answer_label_1,Answer_label_2,Answer_label_3,Answer_label_4,Answer_label_5,Answer_label_6
183,Les étudiants apprennent que le responsable du droit des immigrés va démissionner .,Les étudiants apprennent que les responsables du droit des immigrés vont démissionner .,Les étudiants apprennent que le responsable des droits des immigrés va démissionner .,Les étudiants apprennent que les responsables des droits des immigrés vont démissionner .,Les étudiants apprennent que le responsable du droit de l'immigré va démissionner .,Les étudiants apprennent que les responsables du droit de l'immigré vont démissionner .,Les étudiants apprennent que le responsable des droits de l'immigré va démissionner .,Les étudiants apprennent que les responsables des droits de l'immigré va démissionner .,Les étudiants apprennent que le responsable des droits de l'immigré vont démissionner .,Les étudiants apprennent que les responsables des droits de l'immigré de l'immigré vont démissionner .,Les étudiants apprennent que les responsables des droits de l'immigré vont démissionner .,Les étudiants apprennent que les responsables des droits et l'immigré vont démissionner .,Les étudiants apprennent que les responsables du droit de l'immigré vont démissionner .,False,False,False,True,False,False,agreement_error,N1_alter,mis_num,True,coordination,N2_alter
184,Les enfants disent que le gamin du clochard près des poubelles pleure .,Les enfants disent que les gamins du clochard près des poubelles pleurent .,Les enfants disent que le gamin des clochards près des poubelles pleure .,Les enfants disent que les gamins des clochards près des poubelles pleurent .,Les enfants disent que le gamin du clochard près de la poubelle pleure .,Les enfants disent que les gamins du clochard près de la poubelle pleurent .,Les enfants disent que le gamin des clochards près de la poubelle pleure .,Les enfants disent que le gamin des clochards près de la poubelle pleurent .,Les enfants disent que les gamins des clochards près de la poubelle pleurent .,Les enfants disent que les gamins des clochards près de la poubelle près de la poubelle pleurent .,Les enfants disent que les gamins des clochards près de la poubelle pleure .,Les enfants disent que les gamins des clochards et de la poubelle pleurent .,Les enfants disent que les gamins du clochard près de la poubelle pleurent .,False,True,False,False,False,False,N1_alter,True,mis_num,agreement_error,coordination,N2_alter
185,Les procureurs pensent que l'avocat de l'assassin des villages va revenir .,Les procureurs pensent que les avocats de l'assassin des villages vont revenir .,Les procureurs pensent que l'avocat des assassins des villages va revenir .,Les procureurs pensent que les avocats des assassins des villages vont revenir .,Les procureurs pensent que l'avocat de l'assassin du village va revenir .,Les procureurs pensent que les avocats de l'assassin du village vont revenir .,Les procureurs pensent que l'avocat des assassins du village va revenir .,Les procureurs pensent que les avocats des assassins du village vont revenir .,Les procureurs pensent que les avocats des assassins et le village vont revenir .,Les procureurs pensent que les avocats des assassins du village va revenir .,Les procureurs pensent que les avocats des assassins du village du village vont revenir .,Les procureurs pensent que l'avocat des assassins du village vont revenir .,Les procureurs pensent que les avocats de l'assassin du village vont revenir .,True,False,False,False,False,False,True,coordination,agreement_error,mis_num,N1_alter,N2_alter
186,Les éleveurs ont dit que le cochon du laboureur des champs se vautrait dans la mare .,Les éleveurs ont dit que les cochons du laboureur des champs se vautraient dans la mare .,Les éleveurs ont dit que le cochon des laboureurs des champs se vautrait dans la mare .,Les éleveurs ont dit que les cochons des laboureurs des champs se vautraient dans la mare .,Les éleveurs ont dit que le cochon du laboureur du champs se vautrait dans la mare .,Les éleveurs ont dit que les cochons du laboureur du champs se vautraient dans la mare .,Les éleveurs ont dit que le cochon des laboureurs du champs se vautrait dans la mare .,Les éleveurs ont dit que le cochon des laboureurs du champs se vautraient dans la mare .,Les éleveurs ont dit que les cochons des laboureurs et le champs se vautraient dans la mare .,Les éleveurs ont dit que les cochons des laboureurs du champs se vautraient dans la mare .,Les éleveurs ont dit que les cochons des laboureurs du champs du champs se vautraient dans la mare .,Les éleveurs ont dit que les cochons des laboureurs du champs se vautrait dans la mare .,Les éleveurs ont dit que les cochons du laboureur du champs se vautraient dans la mare .,False,False,True,False,False,False,N1_alter,coordination,True,mis_num,agreement_error,N2_alter
187,Mes cousins observent que la copine du propriétaire des villas dormait sur la plage .,Mes cousins observent que les copines du propriétaire des villas dormaient sur la plage .,Mes cousins observent que la copine des propriétaires des villas dormait sur la plage .,Mes cousins observent que les copines des propriétaires des villas dormaient sur la plage .,Mes cousins observent que la copine du propriétaire de la villa dormait sur la plage .,Mes cousins observent que les copines du propriétaire de la villa dormaient sur la plage .,Mes cousins observent que la copine des propriétaires de la villa dormait sur la plage .,Mes cousins observent que les copines des propriétaires et la villa dormaient sur la plage .,Mes cousins observent que la copine des propriétaires de la villa dormaient sur la plage .,Mes cousins observent que les copines des propriétaires de la villa dormait sur la plage .,Mes cousins observent que les copines des propriétaires de la villa dormaient sur la plage .,Mes cousins observent que les copines des propriétaires de la villa de la villa dormaient sur la plage .,Mes cousins observent que les copines du propriétaire de la villa dormaient sur la plage .,False,False,False,True,False,False,coordination,N1_alter,agreement_error,True,mis_num,N2_alter
188,Les voisins trouvent que l'accompagnatrice du musicien des rues jouait merveilleusement .,Les voisins trouvent que les accompagnatrices du musicien des rues jouaient merveilleusement .,Les voisins trouvent que l'accompagnatrice des musiciens des rues jouait merveilleusement .,Les voisins trouvent que les accompagnatrices des musiciens des rues jouaient merveilleusement .,Les voisins trouvent que l'accompagnatrice du musicien de la rue jouait merveilleusement .,Les voisins trouvent que les accompagnatrices du musicien de la rue jouaient merveilleusement .,Les voisins trouvent que l'accompagnatrice des musiciens de la rue jouait merveilleusement .,Les voisins trouvent que les accompagnatrices du musicien de la rue jouaient merveilleusement .,Les voisins trouvent que les accompagnatrices des musiciens et la rue jouaient merveilleusement .,Les voisins trouvent que les accompagnatrices des musiciens de la rue jouaient merveilleusement .,Les voisins trouvent que l'accompagnatrice des musiciens de la rue jouaient merveilleusement .,Les voisins trouvent que les accompagnatrices des musiciens de la rue de la rue jouaient merveilleusement .,Les voisins trouvent que les accompagnatrices des musiciens de la rue jouait merveilleusement .,False,False,True,False,False,False,N2_alter,coordination,True,N1_alter,mis_num,agreement_error
189,Mes amis disent que le professeur de mon cousin sur les photos ressemble à une star .,Mes amis disent que les professeurs de mon cousin sur les photos ressemblent à une star .,Mes amis disent que le professeur de mes cousins sur les photos ressemble à une star .,Mes amis disent que les professeurs de mes cousins sur les photos ressemblent à une star .,Mes amis disent que le professeur de mon cousin sur la photo ressemble à une star .,Mes amis disent que les professeurs de mon cousin sur la photo ressemblent à une star .,Mes amis disent que le professeur de mes cousins sur la photo ressemble à une star .,Mes amis disent que les professeurs de mes cousins sur la photo sur la photo ressemblent à une star .,Mes amis disent que les professeurs de mes cousins et la photo ressemblent à une star .,Mes amis disent que les professeurs de mes cousins sur la photo ressemble à une star .,Mes amis disent que les professeurs de mes cousins sur la photo ressemblent à une star .,Mes amis disent que le professeur de mes cousins sur la photo ressemblent à une star .,Mes amis disent que les professeurs de mon cousin sur la photo ressemblent à une star .,False,False,False,True,False,False,mis_num,coordination,agreement_error,True,N1_alter,N2_alter
190,Les collègues savent que l'entraîneur du vainqueur des matchs va recevoir une grosse récompense .,Les collègues savent que les entraîneurs du vainqueur des matchs vont recevoir une grosse récompense .,Les collègues savent que l'entraîneur des vainqueurs des matchs va recevoir une grosse récompense .,Les collègues savent que les entraîneurs des vainqueurs des matchs vont recevoir une grosse récompense .,Les collègues savent que l'entraîneur du vainqueur du match va recevoir une grosse récompense .,Les collègues savent que les entraîneurs du vainqueur du match vont recevoir une grosse récompense .,Les collègues savent que l'entraîneur des vainqueurs du match va recevoir une grosse récompense .,Les collègues savent que les entraîneurs des vainqueurs du match va recevoir une grosse récompense .,Les collègues savent que l'entraîneur des vainqueurs du match vont recevoir une grosse récompense .,Les collègues savent que les entraîneurs des vainqueurs du match vont recevoir une grosse récompense .,Les collègues savent que les entraîneurs des vainqueurs et le match vont recevoir une grosse récompense .,Les collègues savent que les entraîneurs du vainqueur du match vont recevoir une grosse récompense .,Les collègues savent que les entraîneurs des vainqueurs du match du match vont recevoir une grosse récompense .,False,False,True,False,False,False,agreement_error,N1_alter,True,coordination,N2_alter,mis_num
191,Les voisins espèrent que le possesseur du perroquet dans les arbres va venir .,Les voisins espèrent que les possesseurs du perroquet dans les arbres vont venir .,Les voisins espèrent que le possesseur des perroquets dans les arbres va venir .,Les voisins espèrent que les possesseurs des perroquets dans les arbres vont venir .,Les voisins espèrent que le possesseur du perroquet dans l'arbre va venir .,Les voisins espèrent que les possesseurs du perroquet dans l'arbre vont venir .,Les voisins espèrent que le possesseur des perroquets dans l'arbre va venir .,Les voisins espèrent que les possesseurs des perroquets et l'arbre vont venir .,Les voisins espèrent que les possesseurs des perroquets dans l'arbre va venir .,Les voisins espèrent que les possesseurs du perroquet dans l'arbre vont venir .,Les voisins espèrent que les possesseurs des perroquets dans l'arbre vont venir .,Les voisins espèrent que les possesseurs des perroquets dans l'arbre dans l'arbre vont venir .,Les voisins espèrent que le possesseur des perroquets dans l'arbre vont venir .,False,False,False,True,False,False,coordination,agreement_error,N2_alter,True,mis_num,N1_alter
192,Jean suppose que l'ordinateur avec les programmes est en panne .,Jean suppose que les ordinateurs avec les programmes sont en panne .,Jean suppose que l'ordinateur avec le programme est en panne .,Jean suppose que les ordinateurs avec le programme sont en panne .,Jean suppose que l'ordinateur avec les programmes de l'expérience est en panne .,Jean suppose que les ordinateurs avec les programmes de l'expérience sont en panne .,Jean suppose que l'ordinateur avec le programme de l'expérience est en panne .,Jean suppose que l'ordinateur avec le programme de l'expérience sont en panne .,Jean suppose que les ordinateurs avec les programmes de l'expérience sont en panne .,Jean suppose que les ordinateurs avec le programme de l'expérience est en panne .,Jean suppose que les ordinateurs avec le programme et l'expérience sont en panne .,Jean suppose que les ordinateurs avec le programme de l'expérience de l'expérience sont en panne .,Jean suppose que les ordinateurs avec le programme de l'expérience sont en panne .,False,False,False,False,False,True,N1_alter,N2_alter,agreement_error,coordination,mis_num,True
193,Le gouvernement a affirmé que l'exposition avec les peintures a rencontré un grand succès .,Le gouvernement a affirmé que les expositions avec les peintures ont rencontré un grand succès .,Le gouvernement a affirmé que l'exposition avec la peinture a rencontré un grand succès .,Le gouvernement a affirmé que les expositions avec la peinture ont rencontré un grand succès .,Le gouvernement a affirmé que l'exposition avec les peintures de l'enfant a rencontré un grand succès .,Le gouvernement a affirmé que les expositions avec les peintures de l'enfant ont rencontré un grand succès .,Le gouvernement a affirmé que l'exposition avec la peinture de l'enfant a rencontré un grand succès .,Le gouvernement a affirmé que les expositions avec les peintures de l'enfant ont rencontré un grand succès .,Le gouvernement a affirmé que les expositions avec la peinture de l'enfant ont rencontré un grand succès .,Le gouvernement a affirmé que les expositions avec la peinture de l'enfant a rencontré un grand succès .,Le gouvernement a affirmé que les expositions avec la peinture et l'enfant ont rencontré un grand succès .,Le gouvernement a affirmé que les expositions avec la peinture de l'enfant de l'enfant ont rencontré un grand succès .,Le gouvernement a affirmé que l'exposition avec la peinture de l'enfant ont rencontré un grand succès .,False,True,False,False,False,False,N2_alter,True,agreement_error,coordination,mis_num,N1_alter
194,Marie dit que le trousseau avec les clés repose sur l’étagère .,Marie dit que les trousseaux avec les clés reposent sur l’étagère .,Marie dit que le trousseau avec la clé repose sur l’étagère .,Marie dit que les trousseaux avec la clé reposent sur l’étagère .,Marie dit que le trousseau avec les clés de la cellule repose sur l’étagère .,Marie dit que les trousseaux avec les clés de la cellule reposent sur l’étagère .,Marie dit que le trousseau avec la clé de la cellule repose sur l’étagère .,Marie dit que les trousseaux avec la clé de la cellule de la cellule reposent sur l’étagère .,Marie dit que les trousseaux avec les clés de la cellule reposent sur l’étagère .,Marie dit que le trousseau avec la clé de la cellule reposent sur l’étagère .,Marie dit que les trousseaux avec la clé et la cellule reposent sur l’étagère .,Marie dit que les trousseaux avec la clé de la cellule reposent sur l’étagère .,Marie dit que les trousseaux avec la clé de la cellule repose sur l’étagère .,False,False,False,False,True,False,mis_num,N2_alter,N1_alter,coordination,True,agreement_error
195,L'éditeur a trouvé que le livre sur les privatisations a enthousiasmé l’auditoire .,L'éditeur a trouvé que les livres sur les privatisations ont enthousiasmé l’auditoire .,L'éditeur a trouvé que le livre sur la privatisation a enthousiasmé l’auditoire .,L'éditeur a trouvé que les livres sur la privatisation ont enthousiasmé l’auditoire .,L'éditeur a trouvé que le livre sur les privatisations de l'entreprise a enthousiasmé l’auditoire .,L'éditeur a trouvé que les livres sur les privatisations de l'entreprise ont enthousiasmé l’auditoire .,L'éditeur a trouvé que le livre sur la privatisation de l'entreprise a enthousiasmé l’auditoire .,L'éditeur a trouvé que les livres sur la privatisation de l'entreprise de l'entreprise ont enthousiasmé l’auditoire .,L'éditeur a trouvé que les livres sur les privatisations de l'entreprise ont enthousiasmé l’auditoire .,L'éditeur a trouvé que les livres sur la privatisation et l'entreprise ont enthousiasmé l’auditoire .,L'éditeur a trouvé que les livres sur la privatisation de l'entreprise ont enthousiasmé l’auditoire .,L'éditeur a trouvé que le livre sur la privatisation de l'entreprise ont enthousiasmé l’auditoire .,L'éditeur a trouvé que les livres sur la privatisation de l'entreprise a enthousiasmé l’auditoire .,False,False,False,True,False,False,mis_num,N2_alter,coordination,True,N1_alter,agreement_error
196,L'organizateur m'a informé que la conférence sur les histoires a commencé plus tard que prévu .,L'organizateur m'a informé que les conférences sur les histoires ont commencé plus tard que prévu .,L'organizateur m'a informé que la conférence sur l'histoire a commencé plus tard que prévu .,L'organizateur m'a informé que les conférences sur l'histoire ont commencé plus tard que prévu .,L'organizateur m'a informé que la conférence sur les histoires de la guerre a commencé plus tard que prévu .,L'organizateur m'a informé que les conférences sur les histoires de la guerre ont commencé plus tard que prévu .,L'organizateur m'a informé que la conférence sur l'histoire de la guerre a commencé plus tard que prévu .,L'organizateur m'a informé que les conférences sur l'histoire et la guerre ont commencé plus tard que prévu .,L'organizateur m'a informé que les conférences sur l'histoire de la guerre de la guerre ont commencé plus tard que prévu .,L'organizateur m'a informé que la conférence sur l'histoire de la guerre ont commencé plus tard que prévu .,L'organizateur m'a informé que les conférences sur l'histoire de la guerre ont commencé plus tard que prévu .,L'organizateur m'a informé que les conférences sur l'histoire de la guerre a commencé plus tard que prévu .,L'organizateur m'a informé que les conférences sur les histoires de la guerre ont commencé plus tard que prévu .,False,False,False,True,False,False,coordination,mis_num,N1_alter,True,agreement_error,N2_alter
197,L'auteur croit que l'étude sur les effet apparaîtra bientôt .,L'auteur croit que les études sur les effet apparaîtront bientôt .,L'auteur croit que l'étude sur l'effet apparaîtra bientôt .,L'auteur croit que les études sur l'effet apparaîtront bientôt .,L'auteur croit que l'étude sur les effet de la drogue apparaîtra bientôt .,L'auteur croit que les études sur les effet de la drogue apparaîtront bientôt .,L'auteur croit que l'étude sur l'effet de la drogue apparaîtra bientôt .,L'auteur croit que les études sur l'effet de la drogue apparaîtront bientôt .,L'auteur croit que les études sur l'effet et la drogue apparaîtront bientôt .,L'auteur croit que les études sur l'effet de la drogue apparaîtra bientôt .,L'auteur croit que les études sur les effet de la drogue apparaîtront bientôt .,L'auteur croit que les études sur l'effet de la drogue de la drogue apparaîtront bientôt .,L'auteur croit que l'étude sur l'effet de la drogue apparaîtront bientôt .,True,False,False,False,False,False,True,coordination,agreement_error,N2_alter,mis_num,N1_alter
198,L'article a rapporté que la théorie sur les chants divise les chercheurs .,L'article a rapporté que les théories sur les chants divisent les chercheurs .,L'article a rapporté que la théorie sur le chant divise les chercheurs .,L'article a rapporté que les théories sur le chant divisent les chercheurs .,L'article a rapporté que la théorie sur les chants du canari divise les chercheurs .,L'article a rapporté que les théories sur les chants du canari divisent les chercheurs .,L'article a rapporté que la théorie sur le chant du canari divise les chercheurs .,L'article a rapporté que les théories sur le chant et le canari divisent les chercheurs .,L'article a rapporté que les théories sur le chant du canari divise les chercheurs .,L'article a rapporté que la théorie sur le chant du canari divisent les chercheurs .,L'article a rapporté que les théories sur le chant du canari divisent les chercheurs .,L'article a rapporté que les théories sur les chants du canari divisent les chercheurs .,L'article a rapporté que les théories sur le chant du canari du canari divisent les chercheurs .,False,False,False,True,False,False,coordination,agreement_error,N1_alter,True,N2_alter,mis_num
199,Ma voisine a raconté que l'inscription sur les portes a énervé sa mère .,Ma voisine a raconté que les inscriptions sur les portes ont énervé sa mère .,Ma voisine a raconté que l'inscription sur la porte a énervé sa mère .,Ma voisine a raconté que les inscriptions sur la porte ont énervé sa mère .,Ma voisine a raconté que l'inscription sur les portes de la chambre a énervé sa mère .,Ma voisine a raconté que les inscriptions sur les portes de la chambre ont énervé sa mère .,Ma voisine a raconté que l'inscription sur la porte de la chambre a énervé sa mère .,Ma voisine a raconté que les inscriptions sur les portes de la chambre ont énervé sa mère .,Ma voisine a raconté que les inscriptions sur la porte de la chambre a énervé sa mère .,Ma voisine a raconté que l'inscription sur la porte de la chambre ont énervé sa mère .,Ma voisine a raconté que les inscriptions sur la porte de la chambre de la chambre ont énervé sa mère .,Ma voisine a raconté que les inscriptions sur la porte et la chambre ont énervé sa mère .,Ma voisine a raconté que les inscriptions sur la porte de la chambre ont énervé sa mère .,False,False,False,False,False,True,N2_alter,agreement_error,N1_alter,mis_num,coordination,True
200,Le journal a mentionné que le dépliant sur les enjeux a beaucoup intéressé .,Le journal a mentionné que les dépliants sur les enjeux ont beaucoup intéressé .,Le journal a mentionné que le dépliant sur l'enjeu a beaucoup intéressé .,Le journal a mentionné que les dépliants sur l'enjeu ont beaucoup intéressé .,Le journal a mentionné que le dépliant sur les enjeux de la communauté a beaucoup intéressé .,Le journal a mentionné que les dépliants sur les enjeux de la communauté ont beaucoup intéressé .,Le journal a mentionné que le dépliant sur l'enjeu de la communauté a beaucoup intéressé .,Le journal a mentionné que les dépliants sur l'enjeu de la communauté ont beaucoup intéressé .,Le journal a mentionné que le dépliant sur l'enjeu de la communauté ont beaucoup intéressé .,Le journal a mentionné que les dépliants sur l'enjeu et la communauté ont beaucoup intéressé .,Le journal a mentionné que les dépliants sur l'enjeu de la communauté de la communauté ont beaucoup intéressé .,Le journal a mentionné que les dépliants sur les enjeux de la communauté ont beaucoup intéressé .,Le journal a mentionné que les dépliants sur l'enjeu de la communauté a beaucoup intéressé .,True,False,False,False,False,False,True,N1_alter,coordination,mis_num,N2_alter,agreement_error
201,Ma cousine m'a dit que la ligne sur les bords a disparu .,Ma cousine m'a dit que les lignes sur les bords ont disparu .,Ma cousine m'a dit que la ligne sur le bord a disparu .,Ma cousine m'a dit que les lignes sur le bord ont disparu .,Ma cousine m'a dit que la ligne sur les bords de la route a disparu .,Ma cousine m'a dit que les lignes sur les bords de la route ont disparu .,Ma cousine m'a dit que la ligne sur le bord de la route a disparu .,Ma cousine m'a dit que la ligne sur le bord de la route ont disparu .,Ma cousine m'a dit que les lignes sur le bord de la route a disparu .,Ma cousine m'a dit que les lignes sur le bord de la route ont disparu .,Ma cousine m'a dit que les lignes sur le bord et la route ont disparu .,Ma cousine m'a dit que les lignes sur le bord de la route de la route ont disparu .,Ma cousine m'a dit que les lignes sur les bords de la route ont disparu .,False,False,True,False,False,False,N1_alter,agreement_error,True,coordination,mis_num,N2_alter
202,Julie a réalisé que la nappe sur les tables brille au soleil .,Julie a réalisé que les nappes sur les tables brillent au soleil .,Julie a réalisé que la nappe sur la table brille au soleil .,Julie a réalisé que les nappes sur la table brillent au soleil .,Julie a réalisé que la nappe sur les tables du banquet brille au soleil .,Julie a réalisé que les nappes sur les tables du banquet brillent au soleil .,Julie a réalisé que la nappe sur la table du banquet brille au soleil .,Julie a réalisé que les nappes sur la table du banquet brillent au soleil .,Julie a réalisé que les nappes sur la table et le banquet brillent au soleil .,Julie a réalisé que les nappes sur les tables du banquet brillent au soleil .,Julie a réalisé que les nappes sur la table du banquet du banquet brillent au soleil .,Julie a réalisé que la nappe sur la table du banquet brillent au soleil .,Julie a réalisé que les nappes sur la table du banquet brille au soleil .,True,False,False,False,False,False,True,coordination,N2_alter,mis_num,N1_alter,agreement_error
